nlmatics/nlm-ingestor
c725429dbf46d6e633965ccbc4c24c14c97c6efc
Container flamboyant_pike 65ff323dca47 started with image build_env_python:3.10
************** configuration **************
You are an expert skilled in environment configuration. You can refer to various files and structures in the repository such as `requirements.txt`, `setup.py`, etc., and use dependency prediction tools like pipreqs to install and download the corresponding third-party libraries in a given Docker image. This ensures that the repository can be successfully configured and able to correctly execute the specified tests.
* Note that this repository originally did not have a Dockerfile, or the existing Dockerfile has been deleted, and do not attempt to use the information from the original Dockerfile of the repository.*

* We have already configured poetry, pipdeptree, and pytest for you; no additional configuration is needed. However, you cannot directly invoke pytest; you need to run tests using `runtest` or `poetryruntest`.

WORK PROCESS:
1. **Read Directory Structure**: Check the folder structure in the root directory, focusing on the configuration files related to setting up the environment.
2. **Determine Python Version**: Decide if you need to switch the Python version in the Docker container. The current version is python:3.10. If you want to switch the Python version, please run the `change_python_version python_version` command, where python_version is the Python version number (for example, `change_python_version 3.9`), and you do not need to add quotation marks. If you do not need to make any changes, please ignore this step. You can also run these commands at any point later during the environment configuration to switch the Python version.
    *Note*: You can only switch the Python version within the container; switching to other images is not allowed.
3. **Check the configuration files in the root directory**: Read configuration files related to setting up the environment, such as: Information in the `.github` folder, `setup.py`, `setup.cfg`, `Pipfile` and `Pipfile.lock`, `environment.yml`, `poetry.lock` and `pyproject.toml`, etc.
3.5 **Try testing (optional)**: Using `runtest` command to check if it is possible to pass the tests directly without any additional configuration.
4. **Review Additional Files**: Consider other potential files and structures for environment configuration.
5. **Automatically install according to the installation script**: Based on the observed structure in the root directory, determine the necessary installation commands:
    a. Poetry Detected: If a poetry.lock file is present in the root directory, Install Poetry using the relevant method for your system. Execute the command `poetry install` to install the dependencies specified in the lock file.
    b. Setup.py Detected: If a setup.py file exists in the root directory, run the command `pip install -e .` to install the package in editable mode along with its dependencies.
    c. Other Descriptor Files: For other specific files that indicate dependency management, assess and determine the appropriate method to install the required dependencies.
    *Note*: We only consider automatically installation script in the repository. Do not consider `requirements.txt` directly in this step!
6. **Collecting Third-Party Library Download List**: In this step, you need to locate all files in the root directory that list dependencies line by line, such as `requirements.txt`, `requirements_dev.txt`, etc. Use a command like `queue_file /repo/requirements.txt` to submit them to the download list. I will handle the unified downloading later.
    If you have determined the path to the requirements file, please enter `waitinglist addfile` followed by the path to the requirements file. For example, `waitinglist addfile /repo/requirements.txt`.
    *Note*: The files you collect must follow the standard requirements.txt format. Do not collect files in any other formats. For instance, if you are unsure about the format of `/repo/requirements_test.txt`, you can use the command `cat /repo/requirements_test.txt` to read the file contents and ensure the file fully meets the requirements before submitting it. If no such dependency-listing files are found, you may skip this step.
    *Note*: In a standard requirements.txt file, each valid entry on a line consists of package_name followed by version_constraints (if there are no version_constraints, the latest version is implied). For example: "numpy==2.1", "numpy>2.0,<3.0", "numpy" (implies the latest version).
    *Note*: We will not collect items that are improperly formatted.
7. **Using pipreqs to Obtain Additional Lists**: In this step, you should use `runpipreqs` to analyze the third-party libraries that need to be installed based on the findings of the previous step. Simply use the command `get pipreqs`, and it will generate a `requirements_pipreqs.txt` file in the project root directory (/repo) and show you the warnings and errors.
    *Note*: If you have already collected some requirements.txt files in Step 5, you do not need to execute `runpipreqs` in this step. Avoid collecting too many dependencies repeatedly. You can directly execute `download` after handling conflicts and formatting errors. If errors occur in subsequent tests, you can then run `runpipreqs`.
8. **Handling pipreqs Warnings**: For warnings that appear in pipreqs, such as not being able to find a module on PyPI, it may be due to a discrepancy between the download name and the import name of a third-party library. For example, `import cv2` requires downloading not `cv2` but `opencv-python`. For each warning, you need to address the discrepancy by ensuring the correct package names are used for the downloads.
    You should review "pipreqs_output.txt" (used to store output during the pipreqs dependency generation process) and "requirements_pipreqs.txt" (the final generated dependency results) to check for any inconsistencies. Use ```diff and ``` to make adjustments to "requirements_pipreqs.txt" as needed.
    *Note*: If you did not execute runpipreqs, then you do not need to perform this step.
9. **Update lists**: Add the "requirements_pipreqs.txt" file generated by pipreqs and corrected by you (or maybe not) to the waiting list using the command `waitinglist addfile /repo/requirements_pipreqs.txt`.
    *Note*: If you did not execute runpipreqs, then you do not need to perform this step.
10. **Resolve version_constraint conflicts**: Process the elements in conflict_list. Based on the information in conflict_list, resolve any existing version_constraints conflicts. Only after these have been resolved can you proceed with the download.
11. **Unified download execution**: After analyzing the original requirements.txt of the repository and the "requirements.txt" generated by pipreqs, and resolving any conflict issues, you need to enter download to execute the unified `download`. This will download each element currently in the waiting_list one by one, and eventually, the download status will be returned.
12. **Error Handling**: After the download is complete, you need to handle the error messages based on the information provided. We will return the list of third-party libraries and their dependencies in your current environment. When resolving these errors, you need to ensure that these dependencies are properly managed. For example, you cannot directly uninstall a package that is required by another package, nor can you install a version that does not meet the constraints.
    For instance, if package A depends on package B with a requirement of "B>=1.0", you cannot simply run pip uninstall B as this would cause package A to lack its dependency. Similarly, you cannot run `pip install B==0.5` because this would not satisfy the requirement of "B>=1.0".
    You can make use of the following tools:
    a.(Strongly recommend) `pipdeptree`: Use pipdeptree to see the structure of the python third-party library downloaded.
    b.(Strongly recommend) `pipdeptree -p <package_name>`: Use pipdeptree -p followed by package_name can display the dependency information of a specific third-party library.
    c.(Strongly recommend) `pip index versions <package_name> --python-version <python_version>`: This command is used to query the versions of a specific package for a particular Python version, including pre-release versions. For example, `pip index versions requests --python-version 3.10` can be used to find the versions of requests that are available for Python 3.10.
    d. `pip install -q`: Use this command to install a specific version of a package with minimal output. This greatly reduces the verbosity, showing only crucial information and final status. It is recommended to specify the version with == to avoid conflicts with the existing environment. For example, use pip install -q requests==2.25.1 to ensure a quiet and specific version installation.
    e. `pip install -e`: Use this command to install a package in "editable" mode. This is particularly useful during development when you want to make changes to the source code and have them immediately reflected in the installed package without needing to reinstall it. For example, pip install -e . will install the package located in the current directory in editable mode. Another common use case is to install a package from a local path or a VCS repository while keeping it editable. For example, pip install -e git+https://github.com/username/repo.git#egg=package_name.
    f. `pip uninstall`: Use this command to uninstall a third-party library. This should be used cautiously as it may cause dependency issues. If you need to change the version of a package, it is better to use `pip install [package_name]==[version]` instead.
    g. `apt-get update -qq && apt-get install [package]=[version] -y -qq`: Use this command to install system packages if needed, remember to use `-y`. Use `-qq` to minimize the output if there is nothing wrong.
    h. `export <variable>=<value>`: Use this command to set system environment variables.
    i. You can use the `--help` parameter to view detailed usage instructions for various tools, such as `pipdeptree --help` and `pip install --help`, etc.
    j. You may also use other commands that are not listed here, including built-in Bash commands and other system commands.
    *Note*: Always consider the potential impact of each command on the system. Aim to achieve the best results with minimal changes.
    *Note*: For modules not found in the error message, first check if the corresponding module is available in the project folder before proceeding with external downloads. For example, if you encounter an error stating ModuleNotFoundError: No module named 'my_module', check if there is a file named my_module.py in your project directory. If it is not present, then you can look for the module externally and download it if necessary.
    *Note*: Do not use external download tools like `git clone` or `wget` to download a large number of files directly in the /repo folder (or its subdirectories) to avoid causing significant changes to the original repository.
    *Note*: Flexibility: You do not need to complete all configurations in one go. If you are unsure whether the configuration is approximately complete, you can use the `runtest` or `poetryruntest`(When you configured in poetry environment) command. I will check the configured environment and return any error messages. Based on the error messages, you can make further adjustments.
    *Note*: In special cases, if you feel that the Docker environment has become too messy to achieve your goal, you can use `clear_configuration` command to restore it to the initial Python 3.10 environment or `change_python_version` and start over.
**Most Important!** You can execute `runtest` or `poetryruntest` anywhere when you decide to test the environment. You do not need to complete all the previous steps; you can directly run `runtest` or `poetryruntest` to check if the configuration is complete and get feedback from the error messages. Be flexible. Our goal is to pass the runtest or poetryruntest checks.
If you encounter import errors such as ModuleNotFoundError or ImportError, you can consider two solutions. One solution is to use external tools like pip or apt-get to download these dependencies. The other solution is to check for local dependencies in the repository; if local dependencies are available, you can use `export PYTHONPATH=` statements to set environment variables (preferably), or modify the __init__.py file to resolve the issue.
Please note that when manually using pip, apt-get, poetry, or other tools to download third-party libraries, try to use the `-q` (quiet) mode if available to reduce intermediate progress bar outputs. Additionally, we will help remove more obvious progress bar information to minimize interference with the analysis.
If you need to install packages using pip, please consider adding them to the waiting list first, and then use the `download` command to proceed with the installation.
In each round of the conversation, we will inform you of the commands that have been correctly executed and have changed the state of the current Docker container. Please reflect on each round's Observation in relation to the current state of the Docker container and decide the subsequent Action.
If you need to run two or more commands, please strictly follow the order by enclosing each command in ONE ```bash and ``` blocks connected by "&&" with ONE line! It is not recommended to use backslashes (\) for line continuation. If you need to execute commands that span multiple lines, it is advisable to write them into a .sh file and then run the executable file. For example, if you want to enter the /repo directory and execute `poetry install`, you should input:
```bash
cd /repo && poetry install
```

It is not recommended to directly input:
```bash
cd /repo
```
```bash
poetry install
```

Nor is it recommended to input:
```bash
cd /repo \
poetry install
```

We also strongly request that you try to write the instructions on the same line as much as possible, and do not break them into multiple lines, as this may cause parsing errors. Even if the line of instructions contains a lot of && connections, do not arbitrarily break it into multiple lines.

We will automatically maintain two lists in the background to facilitate the installation and download of third-party libraries. These are:
1. waiting list: Used to store third-party libraries waiting to be downloaded, including both pip and apt libraries. You can use `waitinglist show` to show all items in it.
2. conflict list: Used to store elements with the same name as those in the waiting list but with inconsistent version constraints. You can use `conflictlist show` to show all items in it.
*Note*: you only need to follow the prompts to complete operations on these lists during the running process and can only manipulate them using the provided commands.
*Note*: Before operating waiting list, conflict list, or download commands, you can use waitinglist show or conflictlist show to observe their structure each time.


IN GOOD FORMAT: 
All your answer must contain Thought and Action. 
Calling CLI tools Action using bash block like ```bash  ```. 
Editing and Writing code Action using diff block like ```diff ```.
The command line you generate will be run in the bash sandbox environment, and the running results will be returned to you through the system messages.

IMPORTANT TIPS: 
        * Each round of reply can only contain one ```bash ``` block, which means Each round of your answers contain only *ONE* action!
        * Please submit the first command first, then after receiving the response, you can issue the second command. You are free to use any other bash communication.

You are now in the Docker environment of python:3.10. Please perform all operations within this environment.
CLI TOOLS: You can call CLI tools in  ```bash ... ``` block as Action with a Thought. like:
### Thought: I need to understand the structure of the root directory.
### Action:
```bash
ls /repo
```

For another example:
### Thought: I need to read the README.md file.
### Action:
```bash
cat README.md
```


CODE EDITING AND WRITING: All changes to files must use the ```diff  ```  block format, with symbols <<<<<<< SEARCH, ======= and >>>>>>> REPLACE 

You need to provide code patch. The patch should according to the original code, indent correctly, and do not include line numbers. The format is as follows: 
### Thought: Modify explanation...
### Action: 
```diff 
/absolute/path/of/target.py
<<<<<<< SEARCH
    exact copy of old line(s) you would like to change
=======
    new line(s) to replace
>>>>>>> REPLACE

<<<<<<< SEARCH
    exact copy of old line(s) you would like to change
=======
    new line(s) to replace
>>>>>>> REPLACE
``` 
Every *SEARCH/REPLACE block must use this format:
1. The opening fence ```diff 
2. The file path alone on a line, verbatim. No bold asterisks, no quotes around it, no escaping of characters, etc.
3. The start of search block: <<<<<<< SEARCH
4. A contiguous chunk of lines to search for in the existing source code
5. The dividing line: =======
6. The lines to replace into the source code
7. The end of the replace block: >>>>>>> REPLACE
8. The closing fence: ``` 
Once you want to modify the code you MUST: 
        * Include *ALL* the code being searched and replaced!
        * Every *SEARCH* section must *EXACTLY MATCH* the existing source code, character for character, including all comments, docstrings, etc.
        * '<<<<<<< SEARCH', '=======' and  '>>>>>>> REPLACE' symbols must be on a line by themselves and cannot be indented.
        * All code modifications must be expressed in the REPLACE format above (including delete an insert). We will find the source code with the highest matching degree in the original file and replace it. Please provide sufficient and unique old line(s) from snippet to facilitate matching.
        * If the code patch you provide is successfully applied, the differences before and after the code modification will be returned.
        * The paths of modified files must be completely absolute paths.
        * Make sure the patch you provide is indented correctly especially in python programs: The indentation of old lines is exactly the same as the original code, and the indentation of new lines is correct.
        * All patches must be based on the original code viewed by the tools, and fabricated code patch(es) is prohibited.
        * Previously successfully applied patches will modify the code, and new patches must be applied based on the current code. Please review the relevant code again then provide new patches.
        * If the old line(s) is empty, it is considered to be inserted at the beginning of the file. If the file does not exist, a new file will be created and the new line will be written. like:
### Thought: Create a.py
### Action:
```diff
/project_path/.../a.py
<<<<<<< SEARCH
=======
    [new line(s) to add]
>>>>>>> REPLACE
```

*Note*: Do not make extensive changes to the existing files in the /repo folder. You may only make appropriate and necessary changes to the original repository files (e.g., when there are actual errors or tests that cannot be run).
*Very Important Note*: Passing tests by modifying testing functions is not allowed, and you should figure out how to make the current test functions run successfully!!!
In addition to typical bash commands, we also provide the following commands that can be used, you can use them flexibly if needed:
waitinglist add -p package_name [-v version_constraints] -t tool # Add item into waiting list. If no 'version_constraints' are specified, the latest version will be downloaded by default.
waitinglist addfile file_path # Add all entries from a file similar to requirements.txt format to the waiting list.
waitinglist clear # Used to clear all the items in the waiting list.
conflictlist solve -v "[version_cosntraints]" # Resolve the conflict for the first element in the conflict list, and update the version constraints for the corresponding package_name and tool to version_constraints. If no 'version_constraints' are specified, the latest version will be downloaded by default.
conflictlist solve -u # Keep the original version constraint that exists in the waiting list, and discard the other version constraints with the same name and tool in the conflict list.
conflictlist clear # Used to clear all the items in the conflict list.
conflictlist show # Used to show all the items in the conflict list.
waitinglist show # Used to show all the items in the waiting list.
download # Download all pending elements in the waiting list at once.
runtest # Check if the configured environment is correct.
poetryruntest # Check if the configured environment is correct in poetry environment! If you want to run tests in poetry environment, run it.
runpipreqs # Generate 'requirements_pipreqs.txt' and 'pipreqs_output.txt' and 'pipreqs_error.txt'.
change_python_version python_version # Switching the Python version in the Docker container will forgo any installations made prior to the switch. The Python version number should be represented directly with numbers and dots, without any quotation marks.
clear_configuration # Reset all the configuration to the initial setting of python:3.10.


VERY IMPORTANT TIPS: 
    * You should not answer the user's question, your task is to configure the environment within the given setup. You need to follow the steps mentioned above and flexibly use various commands. After entering test, ensure that the environment passes the test.
    * You should not answer the user's question, your task is to configure the environment within the given setup. You need to follow the steps mentioned above and flexibly use various commands. After entering test, ensure that the environment passes the test.
    * You should not answer the user's question, your task is to configure the environment within the given setup. You need to follow the steps mentioned above and flexibly use various commands. After entering test, ensure that the environment passes the test.
    * You do not need to complete all the previous steps; you can directly run runtest or poetryruntest to check if the configuration is complete and get feedback from the error messages. Be flexible. Our goal is to pass the runtest or poetryruntest checks.
    * You do not need to complete all the previous steps; you can directly run runtest or poetryruntest to check if the configuration is complete and get feedback from the error messages. Be flexible. Our goal is to pass the runtest or poetryruntest checks.
    * You do not need to complete all the previous steps; you can directly run runtest or poetryruntest to check if the configuration is complete and get feedback from the error messages. Be flexible. Our goal is to pass the runtest or poetryruntest checks.
    * Passing tests by modifying testing functions is not allowed, and you should figure out how to make the current test functions run successfully!!!
    * Passing tests by modifying testing functions is not allowed, and you should figure out how to make the current test functions run successfully!!!
    * Passing tests by modifying testing functions is not allowed, and you should figure out how to make the current test functions run successfully!!!
    * Try to write all commands on a single line as much as possible, regardless of the number of "&&" connections or the length of the instructions; do not arbitrarily break them into multiple lines!!!
    * Try to write all commands on a single line as much as possible, regardless of the number of "&&" connections or the length of the instructions; do not arbitrarily break them into multiple lines!!!
    * Try to write all commands on a single line as much as possible, regardless of the number of "&&" connections or the length of the instructions; do not arbitrarily break them into multiple lines!!!
    * When other configuration methods can be used, try to avoid modifying or deleting the original files, especially do not delete the testing files!!!
    * When other configuration methods can be used, try to avoid modifying or deleting the original files, especially do not delete the testing files!!!
    * When other configuration methods can be used, try to avoid modifying or deleting the original files, especially do not delete the testing files!!!
    * You are not allowed to use commands like `hatch shell` that would open a new shell!!!
    * You are not allowed to use commands like `hatch shell` that would open a new shell!!!
    * You are not allowed to use commands like `hatch shell` that would open a new shell!!!

---------------------------
### Thought: I need to understand the structure of the root directory.
### Action:
```bash
ls /repo
```
### Observation:
Running `ls /repo`...
CONTRIBUTING.md  README.md     notebooks		 run.sh
LICENSE.txt	 jars	       pull_request_template.md  setup.py
NOTICE.txt	 nlm_ingestor  requirements.txt		 tests
`ls /repo` executes with returncode: 0

[Current directory]:
/
You are currently in a [python:3.10] container.

ENVIRONMENT REMINDER: You have 99 turns left to complete the task.
The container remains in its original state.
---------------------------
### Thought: There's a `requirements.txt` file, a `setup.py` file, and some directories related to the project (`nlm_ingestor`, `notebooks`, `tests`). First, I'll check the `setup.py` file to see how the project is structured and which dependencies are listed there.
### Action:
```bash
cat /repo/setup.py
```
### Observation:
Running `cat /repo/setup.py`...
from setuptools import setup, find_packages
setup(
    name='nlm-ingestor',
    version='0.1.7',    
    description='Parsers and ingestors for different file types and formats',
    long_description=open('README.md').read(),
    long_description_content_type='text/markdown',
    url='https://github.com/nlmatics/nlm-ingestor',
    author='Ambika Sukla',
    author_email='ambika.sukla@nlmatics.com',
    license='Apache License 2.0',
    packages=find_packages(),
    include_package_data=True,
    package_data={'': ['ingestor_utils/*.txt', ]},
    install_requires=[
        "flask",
        "flask_restful",
        "flask_jsonpify",
        "gunicorn",
        "werkzeug",
        "tika",
        "bs4",
        "nltk",
        "python-magic",
        "numpy",
        "tqdm",
        "symspellpy>=6.7.0",
        "pandas>=1.2.4",
        "mistune==2.0.3",
        "lxml==4.9.1",
        "unidecode",
        "nlm-utils"        
    ],
    classifiers=[
        'Development Status :: 5 - Production/Stable',
        'Development Status :: 1 - Planning',
        'Intended Audience :: Science/Research',
        'Intended Audience :: Developers',
        'Intended Audience :: Legal Industry',
        'License :: OSI Approved :: Apache Software License',
        'Operating System :: POSIX :: Linux',
        'Programming Language :: Python :: 3 :: Only'        
    ],
)
`cat /repo/setup.py` executes with returncode: 0

[Current directory]:
/
You are currently in a [python:3.10] container.

ENVIRONMENT REMINDER: You have 98 turns left to complete the task.
The container remains in its original state.
---------------------------
### Thought: The `setup.py` file indicates the necessary dependencies listed in the `install_requires` section. Now, I'll try running `runtest` to see if the tests pass with the current configuration.
### Action:
```bash
runtest
```
### Observation:
Running `python /home/tools/runtest.py`...
Error: Please modify the configuration according to the error messages below. Once all issues are resolved, rerun the tests.
==================================== ERRORS ====================================
_______________ ERROR collecting tests/run_ingestor_page_test.py _______________
ImportError while importing test module '/repo/tests/run_ingestor_page_test.py'.
Hint: make sure your test modules/packages have valid Python names.
Traceback:
/usr/local/lib/python3.10/importlib/__init__.py:126: in import_module
    return _bootstrap._gcd_import(name[level:], package, level)
tests/run_ingestor_page_test.py:7: in <module>
    from bs4 import BeautifulSoup
E   ModuleNotFoundError: No module named 'bs4'
__________________ ERROR collecting tests/test_line_parser.py __________________
ImportError while importing test module '/repo/tests/test_line_parser.py'.
Hint: make sure your test modules/packages have valid Python names.
Traceback:
/usr/local/lib/python3.10/importlib/__init__.py:126: in import_module
    return _bootstrap._gcd_import(name[level:], package, level)
tests/test_line_parser.py:3: in <module>
    from ingestor import line_parser as lp
E   ModuleNotFoundError: No module named 'ingestor'
___________________ ERROR collecting tests/test_processor.py ___________________
ImportError while importing test module '/repo/tests/test_processor.py'.
Hint: make sure your test modules/packages have valid Python names.
Traceback:
/usr/local/lib/python3.10/importlib/__init__.py:126: in import_module
    return _bootstrap._gcd_import(name[level:], package, level)
tests/test_processor.py:3: in <module>
    from ingestor import formatter
E   ModuleNotFoundError: No module named 'ingestor'
________________ ERROR collecting tests/test_sent_tokenizer.py _________________
ImportError while importing test module '/repo/tests/test_sent_tokenizer.py'.
Hint: make sure your test modules/packages have valid Python names.
Traceback:
/usr/local/lib/python3.10/importlib/__init__.py:126: in import_module
    return _bootstrap._gcd_import(name[level:], package, level)
tests/test_sent_tokenizer.py:3: in <module>
    from ingestor_utils.utils import sent_tokenize
E   ModuleNotFoundError: No module named 'ingestor_utils'
=========================== short test summary info ============================
ERROR tests/run_ingestor_page_test.py
ERROR tests/test_line_parser.py
ERROR tests/test_processor.py
ERROR tests/test_sent_tokenizer.py
!!!!!!!!!!!!!!!!!!! Interrupted: 4 errors during collection !!!!!!!!!!!!!!!!!!!!
no tests collected, 4 errors in 0.24s
The command execution failed, so I have reverted it back to the previous state, which is the environment before running this command.
`runtest` executes with returncode: 2

[Current directory]:
/
You are currently in a [python:3.10] container.

ENVIRONMENT REMINDER: You have 97 turns left to complete the task.
The container remains in its original state.
---------------------------
### Thought: There are several `ModuleNotFoundError` errors for the packages `bs4`, `ingestor`, and `ingestor_utils`. Based on the `setup.py`, some dependencies are missing. I will first perform installation based on the `setup.py`.

### Action:
```bash
cd /repo && pip install -e .
```
### Observation:
Running `cd /repo`...
`cd /repo` executes with returncode: 0
Running `pip install -e .`...
The output is too long, so we've truncated it to show you the first and last 5000 characters.
Running `pip install -e .`...
Looking in indexes: http://simple/
Obtaining file:///repo
  Preparing metadata (setup.py) ... [?25l- done
  Downloading http://packages/flask/flask-3.1.0-py3-none-any.whl (102 kB)
Collecting flask_restful (from nlm-ingestor==0.1.7)
  Downloading http://packages/flask-restful/Flask_RESTful-0.3.10-py2.py3-none-any.whl (26 kB)
Collecting flask_jsonpify (from nlm-ingestor==0.1.7)
  Downloading http://packages/flask-jsonpify/Flask-Jsonpify-1.5.0.tar.gz (3.0 kB)
  Preparing metadata (setup.py) ... [?25l- done
  Downloading http://packages/gunicorn/gunicorn-23.0.0-py3-none-any.whl (85 kB)
Collecting werkzeug (from nlm-ingestor==0.1.7)
  Downloading http://packages/werkzeug/werkzeug-3.1.3-py3-none-any.whl (224 kB)
Collecting tika (from nlm-ingestor==0.1.7)
  Downloading http://packages/tika/tika-2.6.0.tar.gz (27 kB)
  Preparing metadata (setup.py) ... [?25l- done
  Downloading http://packages/bs4/bs4-0.0.2-py2.py3-none-any.whl (1.2 kB)
Collecting nltk (from nlm-ingestor==0.1.7)
  Downloading http://packages/nltk/nltk-3.9.1-py3-none-any.whl (1.5 MB)
  Downloading http://packages/python-magic/python_magic-0.4.27-py2.py3-none-any.whl (13 kB)
Collecting numpy (from nlm-ingestor==0.1.7)
  Downloading http://packages/numpy/numpy-2.2.1-cp310-cp310-manylinux_2_17_x86_64.manylinux2014_x86_64.whl (16.4 MB)
  Downloading http://packages/tqdm/tqdm-4.67.1-py3-none-any.whl (78 kB)
Collecting symspellpy>=6.7.0 (from nlm-ingestor==0.1.7)
  Downloading http://packages/symspellpy/symspellpy-6.7.8-py3-none-any.whl (2.6 MB)
  Downloading http://packages/pandas/pandas-2.2.3-cp310-cp310-manylinux_2_17_x86_64.manylinux2014_x86_64.whl (13.1 MB)
  Downloading http://packages/mistune/mistune-2.0.3-py2.py3-none-any.whl (24 kB)
Collecting lxml==4.9.1 (from nlm-ingestor==0.1.7)
  Downloading http://packages/lxml/lxml-4.9.1-cp310-cp310-manylinux_2_17_x86_64.manylinux2014_x86_64.manylinux_2_24_x86_64.whl (6.9 MB)
  Downloading http://packages/unidecode/Unidecode-1.3.8-py3-none-any.whl (235 kB)
Collecting nlm-utils (from nlm-ingestor==0.1.7)
  Downloading http://packages/nlm-utils/nlm_utils-0.1.2-py3-none-any.whl (74 kB)
Collecting python-dateutil>=2.8.2 (from pandas>=1.2.4->nlm-ingestor==0.1.7)
  Downloading http://packages/python-dateutil/python_dateutil-2.9.0.post0-py2.py3-none-any.whl (229 kB)
Collecting pytz>=2020.1 (from pandas>=1.2.4->nlm-ingestor==0.1.7)
  Downloading http://packages/pytz/pytz-2024.2-py2.py3-none-any.whl (508 kB)
Collecting tzdata>=2022.7 (from pandas>=1.2.4->nlm-ingestor==0.1.7)
  Downloading http://packages/tzdata/tzdata-2024.2-py2.py3-none-any.whl (346 kB)
Collecting editdistpy>=0.1.3 (from symspellpy>=6.7.0->nlm-ingestor==0.1.7)
  Downloading http://packages/editdistpy/editdistpy-0.1.5-cp310-cp310-manylinux_2_5_x86_64.manylinux1_x86_64.manylinux_2_17_x86_64.manylinux2014_x86_64.whl (144 kB)
Collecting beautifulsoup4 (from bs4->nlm-ingestor==0.1.7)
  Downloading http://packages/beautifulsoup4/beautifulsoup4-4.12.3-py3-none-any.whl (147 kB)
Collecting Jinja2>=3.1.2 (from flask->nlm-ingestor==0.1.7)
  Downloading http://packages/jinja2/jinja2-3.1.5-py3-none-any.whl (134 kB)
Collecting itsdangerous>=2.2 (from flask->nlm-ingestor==0.1.7)
  Downloading http://packages/itsdangerous/itsdangerous-2.2.0-py3-none-any.whl (16 kB)
Collecting click>=8.1.3 (from flask->nlm-ingestor==0.1.7)
  Downloading http://packages/click/click-8.1.8-py3-none-any.whl (98 kB)
Collecting blinker>=1.9 (from flask->nlm-ingestor==0.1.7)
  Downloading http://packages/blinker/blinker-1.9.0-py3-none-any.whl (8.5 kB)
Collecting MarkupSafe>=2.1.1 (from werkzeug->nlm-ingestor==0.1.7)
  Downloading http://packages/markupsafe/MarkupSafe-3.0.2-cp310-cp310-manylinux_2_17_x86_64.manylinux2014_x86_64.whl (20 kB)
Collecting aniso8601>=0.82 (from flask_restful->nlm-ingestor==0.1.7)
  Downloading http://packages/aniso8601/aniso8601-9.0.1-py2.py3-none-any.whl (52 kB)
Collecting six>=1.3.0 (from flask_restful->nlm-ingestor==0.1.7)
  Downloading http://packages/six/six-1.17.0-py2.py3-none-any.whl (11 kB)
Requirement already satisfied: packaging in /usr/local/lib/python3.10/site-packages (from gunicorn->nlm-ingestor==0.1.7) (24.2)
Collecting aiohttp==3.8.5 (from nlm-utils->nlm-ingestor==0.1.7)
  Downloading http://packages/aiohttp/aiohttp-3.8.5-cp310-cp310-manylinux_2_17_x86_64.manylinux2014_x86_64.whl (1.0 MB)
  Downloading http://packages/dateparser/dateparser-1.2.0-py2.py3-none-any.whl (294 kB)
Collecting dnspython==2.1.0 (from nlm-utils->nlm-ingestor==0.1.7)
  Downloading http://packages/dnspython/dnspython-2.1.0-py3-none-any.whl (241 kB)
Collecting word2number (from nlm-utils->nlm-ingestor==0.1.7)
  Downloading http://packages/word2number/word2number-1.1.zip (9.7 kB)
  Preparing metadata (setup.py) ... [?25l- done
  Downloading http://packages/minio/minio-7.1.0-py3-none-any.whl (75 kB)
Collecting money==1.3.0 (from nlm-utils->nlm-ingestor==0.1.7)
  Downloading http://packages/money/money-1.3.0.tar.gz (18 kB)
  Preparing metadata (setup.py) ... [?25l- done
  Downloading http://packages/msgpack/msgpack-1.0.2.tar.gz (123 kB)
  Preparing metadata (setup.py) ... [?25l- done
  Downloading http://packages/nltk/nltk-3.6.2-py3-none-any.whl (1.5 MB)
  Downloading
...[Truncation]...
ic<3,>=1.9.0->openai->nlm-utils->nlm-ingestor==0.1.7)
  Downloading http://packages/pydantic-core/pydantic_core-2.27.2-cp310-cp310-manylinux_2_17_x86_64.manylinux2014_x86_64.whl (2.0 MB)
[?25l     [90m━━━━━━━━━━━━━━━━━━━━━━━━━━━━━━━━━━━━━━━━[0m [32m0.0/2.0 MB[0m [31m?[0m eta [36m-:--:--[0m
[2K     [90m━━━━━━━━━━━━━━━━━━━━━━━━━━━━━━━━━━━━━━━━[0m [32m2.0/2.0 MB[0m [31m75.3 MB/s[0m eta [36m0:00:00[0m
[?25hCollecting propcache>=0.2.0 (from yarl<2.0,>=1.0->aiohttp==3.8.5->nlm-utils->nlm-ingestor==0.1.7)
  Downloading http://packages/propcache/propcache-0.2.1-cp310-cp310-manylinux_2_17_x86_64.manylinux2014_x86_64.whl (205 kB)
Building wheels for collected packages: flask_jsonpify, money, msgpack, pymongo, xxhash, tika, word2number
  Building wheel for flask_jsonpify (setup.py) ... [?25l- \ done
[?25h  Created wheel for flask_jsonpify: filename=Flask_Jsonpify-1.5.0-py3-none-any.whl size=3082 sha256=2f0a96e6f69fe6c263566b7630b4434f095ae164559062ec0ca1989af0fe412c
  Stored in directory: /root/.cache/pip/wheels/ff/a4/5d/df225d786f1895930aa7660d2307bf35417ef07d49554c2796
  Building wheel for money (setup.py) ... [?25l- done
[?25h  Created wheel for money: filename=money-1.3.0-py3-none-any.whl size=6622 sha256=0f668ff26b8702a709c5967c0e986003f3d49b1634444111532689e3ffbb9286
  Stored in directory: /root/.cache/pip/wheels/85/c7/54/17874b04243ce16134335437ea4c8113d040b529f0ace2df63
  Building wheel for msgpack (setup.py) ... [?25l- \ | / done
[?25h  Created wheel for msgpack: filename=msgpack-1.0.2-cp310-cp310-linux_x86_64.whl size=316802 sha256=0bdb6d0c1f587757b9ed322a8611554d0ccc9b34845c6443a8ceacca707148cd
  Stored in directory: /root/.cache/pip/wheels/6a/c0/0d/1ba32788fec086ad1f0f700075fdf76b200f9343d0cb204f1a
  Building wheel for pymongo (setup.py) ... [?25l- \ | / - \ | done
[?25h  Created wheel for pymongo: filename=pymongo-3.11.4-cp310-cp310-linux_x86_64.whl size=496851 sha256=1c24b6171fc29a0d3d49ff1eb14494ceb9fec2e8b1ac09e36c05303bbfbfcc8c
  Stored in directory: /root/.cache/pip/wheels/6d/25/77/67ee13c73d5204b373f1732a87be0a8630acc2818653e49a4e
  Building wheel for xxhash (setup.py) ... [?25l- \ | / done
[?25h  Created wheel for xxhash: filename=xxhash-2.0.2-cp310-cp310-linux_x86_64.whl size=203859 sha256=ba0d4134f38250ab15de9994cc549d3c35a42adfbf3f65385e4743e3f0274987
  Stored in directory: /root/.cache/pip/wheels/a9/91/c3/8a593dc85935ef37a482143e9cc693c096da277348d9fc9ecf
  Building wheel for tika (setup.py) ... [?25l- done
[?25h  Created wheel for tika: filename=tika-2.6.0-py3-none-any.whl size=32623 sha256=7f8fed9a659e19ba175361a60ccc00b300a22a283aff02ad0369673318568657
  Stored in directory: /root/.cache/pip/wheels/87/25/09/4be3251bdc94c641f2d795e08cd69f46ad5b79acca1917df67
  Building wheel for word2number (setup.py) ... [?25l- done
[?25h  Created wheel for word2number: filename=word2number-1.1-py3-none-any.whl size=5566 sha256=da6ffe64fc1c49427895c819dab27aa242d0e1adff9e78192b2fd6a93c90c2c1
  Stored in directory: /root/.cache/pip/wheels/ca/5d/60/f3ed854f58369eaaed6335ef8fa1cb692cfe513f411498ef57
Successfully built flask_jsonpify money msgpack pymongo xxhash tika word2number
Installing collected packages: word2number, pytz, msgpack, money, mistune, aniso8601, xxhash, urllib3, unidecode, tzlocal, tzdata, typing-extensions, tqdm, soupsieve, sniffio, six, regex, redis, python-magic, pymongo, propcache, numpy, MarkupSafe, lxml, joblib, jiter, itsdangerous, idna, h11, gunicorn, frozenlist, editdistpy, dnspython, distro, dicttoxml, click, charset-normalizer, certifi, blinker, attrs, async-timeout, annotated-types, werkzeug, symspellpy, requests, python-dateutil, pydantic-core, nltk, multidict, minio, Jinja2, httpcore, beautifulsoup4, anyio, aiosignal, yarl, tiktoken, tika, pydantic, pandas, httpx, flask, dateparser, bs4, openai, flask_restful, flask_jsonpify, aiohttp, nlm-utils, nlm-ingestor
[33m  DEPRECATION: Legacy editable install of nlm-ingestor==0.1.7 from file:///repo (setup.py develop) is deprecated. pip 25.0 will enforce this behaviour change. A possible replacement is to add a pyproject.toml or enable --use-pep517, and use setuptools >= 64. If the resulting installation is not behaving as expected, try using --config-settings editable_mode=compat. Please consult the setuptools documentation for more information. Discussion can be found at https://github.com/pypa/pip/issues/11457[0m[33m
[0m  Running setup.py develop for nlm-ingestor
Successfully installed Jinja2-3.1.5 MarkupSafe-3.0.2 aiohttp-3.8.5 aiosignal-1.3.2 aniso8601-9.0.1 annotated-types-0.7.0 anyio-4.8.0 async-timeout-4.0.3 attrs-24.3.0 beautifulsoup4-4.12.3 blinker-1.9.0 bs4-0.0.2 certifi-2024.12.14 charset-normalizer-3.4.1 click-8.1.8 dateparser-1.2.0 dicttoxml-1.7.16 distro-1.9.0 dnspython-2.1.0 editdistpy-0.1.5 flask-3.1.0 flask_jsonpify-1.5.0 flask_restful-0.3.10 frozenlist-1.5.0 gunicorn-23.0.0 h11-0.14.0 httpcore-1.0.7 httpx-0.28.1 idna-3.10 itsdangerous-2.2.0 jiter-0.8.2 joblib-1.4.2 lxml-4.9.1 minio-7.1.0 mistune-2.0.3 money-1.3.0 msgpack-1.0.2 multidict-6.1.0 nlm-ingestor nlm-utils-0.1.2 nltk-3.6.2 numpy-1.24.4 openai-1.59.5 pandas-2.2.3 propcache-0.2.1 pydantic-2.10.5 pydantic-core-2.27.2 pymongo-3.11.4 python-dateutil-2.9.0.post0 python-magic-0.4.22 pytz-2024.2 redis-3.5.3 regex-2024.11.6 requests-2.32.3 six-1.17.0 sniffio-1.3.1 soupsieve-2.6 symspellpy-6.7.8 tika-2.6.0 tiktoken-0.8.0 tqdm-4.67.1 typing-extensions-4.12.2 tzdata-2024.2 tzlocal-5.2 unidecode-1.3.8 urllib3-1.26.6 werkzeug-3.1.3 word2number-1.1 xxhash-2.0.2 yarl-1.18.3
[33mWARNING: Running pip as the 'root' user can result in broken permissions and conflicting behaviour with the system package manager, possibly rendering your system unusable.It is recommended to use a virtual environment instead: https://pip.pypa.io/warnings/venv. Use the --root-user-action option if you know what you are doing and want to suppress this warning.[0m[33m
`pip install -e .` executes with returncode: 0

[Current directory]:
/repo
You are currently in a [python:3.10] container.

ENVIRONMENT REMINDER: You have 96 turns left to complete the task.
The container has successfully executed the following commands in order. Please refer to the execution history, reflect, and decide the subsequent actions. Remember, your ultimate goal is to pass the tests by executing `runtest` or `poetryruntest`.
cd /repo && pip install -e .
---------------------------
### Thought: Now that the dependencies have been installed, I will rerun the tests to see if the environment is properly configured and if the tests can be collected and executed.
### Action:
```bash
runtest
```
### Observation:
Running `python /home/tools/runtest.py`...
Error: Please modify the configuration according to the error messages below. Once all issues are resolved, rerun the tests.
==================================== ERRORS ====================================
_______________ ERROR collecting tests/run_ingestor_page_test.py _______________
tests/run_ingestor_page_test.py:12: in <module>
    from nlm_ingestor.ingestor import table_parser
nlm_ingestor/ingestor/__init__.py:5: in <module>
    from .pdf_ingestor import *
nlm_ingestor/ingestor/pdf_ingestor.py:12: in <module>
    from .visual_ingestor import visual_ingestor
nlm_ingestor/ingestor/visual_ingestor/visual_ingestor.py:16: in <module>
    from nlm_ingestor.ingestor_utils.utils import sent_tokenize
nlm_ingestor/ingestor_utils/utils.py:9: in <module>
    nltk_abbs = load("tokenizers/punkt/{}.pickle".format("english"))._params.abbrev_types
/usr/local/lib/python3.10/site-packages/nltk/data.py:750: in load
    opened_resource = _open(resource_url)
/usr/local/lib/python3.10/site-packages/nltk/data.py:875: in _open
    return find(path_, path + [""]).open()
/usr/local/lib/python3.10/site-packages/nltk/data.py:583: in find
    raise LookupError(resource_not_found)
E   LookupError: 
E   **********************************************************************
E     Resource [93mpunkt[0m not found.
E     Please use the NLTK Downloader to obtain the resource:
E   
E     [31m>>> import nltk
E     >>> nltk.download('punkt')
E     [0m
E     For more information see: https://www.nltk.org/data.html
E   
E     Attempted to load [93mtokenizers/punkt/PY3/english.pickle[0m
E   
E     Searched in:
E       - '/root/nltk_data'
E       - '/usr/local/nltk_data'
E       - '/usr/local/share/nltk_data'
E       - '/usr/local/lib/nltk_data'
E       - '/usr/share/nltk_data'
E       - '/usr/local/share/nltk_data'
E       - '/usr/lib/nltk_data'
E       - '/usr/local/lib/nltk_data'
E       - ''
E   **********************************************************************
__________________ ERROR collecting tests/test_line_parser.py __________________
ImportError while importing test module '/repo/tests/test_line_parser.py'.
Hint: make sure your test modules/packages have valid Python names.
Traceback:
/usr/local/lib/python3.10/importlib/__init__.py:126: in import_module
    return _bootstrap._gcd_import(name[level:], package, level)
tests/test_line_parser.py:3: in <module>
    from ingestor import line_parser as lp
E   ModuleNotFoundError: No module named 'ingestor'
___________________ ERROR collecting tests/test_processor.py ___________________
ImportError while importing test module '/repo/tests/test_processor.py'.
Hint: make sure your test modules/packages have valid Python names.
Traceback:
/usr/local/lib/python3.10/importlib/__init__.py:126: in import_module
    return _bootstrap._gcd_import(name[level:], package, level)
tests/test_processor.py:3: in <module>
    from ingestor import formatter
E   ModuleNotFoundError: No module named 'ingestor'
________________ ERROR collecting tests/test_sent_tokenizer.py _________________
ImportError while importing test module '/repo/tests/test_sent_tokenizer.py'.
Hint: make sure your test modules/packages have valid Python names.
Traceback:
/usr/local/lib/python3.10/importlib/__init__.py:126: in import_module
    return _bootstrap._gcd_import(name[level:], package, level)
tests/test_sent_tokenizer.py:3: in <module>
    from ingestor_utils.utils import sent_tokenize
E   ModuleNotFoundError: No module named 'ingestor_utils'
=========================== short test summary info ============================
ERROR tests/run_ingestor_page_test.py - LookupError: 
ERROR tests/test_line_parser.py
ERROR tests/test_processor.py
ERROR tests/test_sent_tokenizer.py
!!!!!!!!!!!!!!!!!!! Interrupted: 4 errors during collection !!!!!!!!!!!!!!!!!!!!
no tests collected, 4 errors in 6.08s
The command execution failed, so I have reverted it back to the previous state, which is the environment before running this command.
`runtest` executes with returncode: 2

[Current directory]:
/
You are currently in a [python:3.10] container.

ENVIRONMENT REMINDER: You have 95 turns left to complete the task.
The container has successfully executed the following commands in order. Please refer to the execution history, reflect, and decide the subsequent actions. Remember, your ultimate goal is to pass the tests by executing `runtest` or `poetryruntest`.
cd /repo && pip install -e .
---------------------------
### Thought: The error `LookupError: Resource 'punkt' not found` indicates that the NLTK 'punkt' tokenizer data needs to be downloaded. Additionally, there are still issues with the `ingestor` and `ingestor_utils` modules not being found. I will first address the NLTK data issue and proceed to download the necessary resource.
### Action:
```bash
python -m nltk.downloader punkt
```
### Observation:
Running `python -m nltk.downloader punkt`...
/usr/local/lib/python3.10/runpy.py:126: RuntimeWarning: 'nltk.downloader' found in sys.modules after import of package 'nltk', but prior to execution of 'nltk.downloader'; this may result in unpredictable behaviour
  warn(RuntimeWarning(msg))
[nltk_data] Downloading package punkt to /root/nltk_data...
[nltk_data]   Unzipping tokenizers/punkt.zip.
`python -m nltk.downloader punkt` executes with returncode: 0

[Current directory]:
/
You are currently in a [python:3.10] container.

ENVIRONMENT REMINDER: You have 94 turns left to complete the task.
The container has successfully executed the following commands in order. Please refer to the execution history, reflect, and decide the subsequent actions. Remember, your ultimate goal is to pass the tests by executing `runtest` or `poetryruntest`.
cd /repo && pip install -e .
python -m nltk.downloader punkt
---------------------------
### Thought: The NLTK 'punkt' data has been successfully downloaded. Now, I will investigate why the `ingestor` and `ingestor_utils` modules are not found. These modules should be part of the project, and it seems they are located within the `nlm_ingestor` directory. I will inspect the `nlm_ingestor` directory to confirm the structure and identify these modules.
### Action:
```bash
ls /repo/nlm_ingestor/ingestor
```
### Observation:
Running `ls /repo/nlm_ingestor/ingestor`...
__init__.py	  ingestor_api.py  processors_utils.py	 text_ingestor.py
block.py	  line_parser.py   sec_html_ingestor.py  visual_ingestor
data_loader.py	  patterns.py	   styling_utils.py	 xml_ingestor.py
formatter.py	  pdf_ingestor.py  table_builder.py
html_ingestor.py  processors.py    table_parser.py
`ls /repo/nlm_ingestor/ingestor` executes with returncode: 0

[Current directory]:
/
You are currently in a [python:3.10] container.

ENVIRONMENT REMINDER: You have 93 turns left to complete the task.
The container has successfully executed the following commands in order. Please refer to the execution history, reflect, and decide the subsequent actions. Remember, your ultimate goal is to pass the tests by executing `runtest` or `poetryruntest`.
cd /repo && pip install -e .
python -m nltk.downloader punkt
---------------------------
### Thought: The `ingestor` module exists within the `nlm_ingestor` directory as confirmed. Now, I will investigate the `nlm_ingestor/ingestor_utils` directory to locate the `ingestor_utils` module.
### Action:
```bash
ls /repo/nlm_ingestor/ingestor_utils
```
### Observation:
Running `ls /repo/nlm_ingestor/ingestor_utils`...
__init__.py		lru_cache.py  parsing_utils.py	word_splitter.py
de_duplicate_engine.py	ner_dict.py   spell_utils.py	words.txt
ing_named_tuples.py	objects.py    utils.py
`ls /repo/nlm_ingestor/ingestor_utils` executes with returncode: 0

[Current directory]:
/
You are currently in a [python:3.10] container.

ENVIRONMENT REMINDER: You have 92 turns left to complete the task.
The container has successfully executed the following commands in order. Please refer to the execution history, reflect, and decide the subsequent actions. Remember, your ultimate goal is to pass the tests by executing `runtest` or `poetryruntest`.
cd /repo && pip install -e .
python -m nltk.downloader punkt
---------------------------
### Thought: Both `ingestor` and `ingestor_utils` modules exist within the `nlm_ingestor` directory. However, the current import paths in the test files might not be correctly pointing to these modules. To correct this, I will try to set the `PYTHONPATH` to `/repo` and rerun the tests.

### Action:
```bash
export PYTHONPATH=/repo && runtest
```
### Observation:
Running `export PYTHONPATH=/repo`...
`export PYTHONPATH=/repo` executes with returncode: 0
Running `python /home/tools/runtest.py`...
Error: Please modify the configuration according to the error messages below. Once all issues are resolved, rerun the tests.
==================================== ERRORS ====================================
_______________ ERROR collecting tests/run_ingestor_page_test.py _______________
/usr/local/lib/python3.10/site-packages/nltk/corpus/util.py:83: in __load
    root = nltk.data.find("{}/{}".format(self.subdir, zip_name))
/usr/local/lib/python3.10/site-packages/nltk/data.py:583: in find
    raise LookupError(resource_not_found)
E   LookupError: 
E   **********************************************************************
E     Resource [93mstopwords[0m not found.
E     Please use the NLTK Downloader to obtain the resource:
E   
E     [31m>>> import nltk
E     >>> nltk.download('stopwords')
E     [0m
E     For more information see: https://www.nltk.org/data.html
E   
E     Attempted to load [93mcorpora/stopwords.zip/stopwords/[0m
E   
E     Searched in:
E       - '/root/nltk_data'
E       - '/usr/local/nltk_data'
E       - '/usr/local/share/nltk_data'
E       - '/usr/local/lib/nltk_data'
E       - '/usr/share/nltk_data'
E       - '/usr/local/share/nltk_data'
E       - '/usr/lib/nltk_data'
E       - '/usr/local/lib/nltk_data'
E   **********************************************************************
During handling of the above exception, another exception occurred:
nlm_ingestor/ingestor/line_parser.py:15: in <module>
    stop_words = set(stopwords.words("english"))
/usr/local/lib/python3.10/site-packages/nltk/corpus/util.py:120: in __getattr__
    self.__load()
/usr/local/lib/python3.10/site-packages/nltk/corpus/util.py:85: in __load
    raise e
/usr/local/lib/python3.10/site-packages/nltk/corpus/util.py:80: in __load
    root = nltk.data.find("{}/{}".format(self.subdir, self.__name))
/usr/local/lib/python3.10/site-packages/nltk/data.py:583: in find
    raise LookupError(resource_not_found)
E   LookupError: 
E   **********************************************************************
E     Resource [93mstopwords[0m not found.
E     Please use the NLTK Downloader to obtain the resource:
E   
E     [31m>>> import nltk
E     >>> nltk.download('stopwords')
E     [0m
E     For more information see: https://www.nltk.org/data.html
E   
E     Attempted to load [93mcorpora/stopwords[0m
E   
E     Searched in:
E       - '/root/nltk_data'
E       - '/usr/local/nltk_data'
E       - '/usr/local/share/nltk_data'
E       - '/usr/local/lib/nltk_data'
E       - '/usr/share/nltk_data'
E       - '/usr/local/share/nltk_data'
E       - '/usr/lib/nltk_data'
E       - '/usr/local/lib/nltk_data'
E   **********************************************************************
During handling of the above exception, another exception occurred:
tests/run_ingestor_page_test.py:12: in <module>
    from nlm_ingestor.ingestor import table_parser
nlm_ingestor/ingestor/__init__.py:5: in <module>
    from .pdf_ingestor import *
nlm_ingestor/ingestor/pdf_ingestor.py:12: in <module>
    from .visual_ingestor import visual_ingestor
nlm_ingestor/ingestor/visual_ingestor/visual_ingestor.py:18: in <module>
    from nlm_ingestor.ingestor.visual_ingestor import style_utils, table_parser, indent_parser, block_renderer, order_fixer
nlm_ingestor/ingestor/visual_ingestor/table_parser.py:7: in <module>
    from nlm_ingestor.ingestor import line_parser
nlm_ingestor/ingestor/line_parser.py:21: in <module>
    stop_words = set(stopwords.words("english"))
E   AttributeError: 'bool' object has no attribute 'words'
------------------------------- Captured stderr --------------------------------
[nltk_data] Downloading package stopwords to /root/nltk_data...
[nltk_data]   Unzipping corpora/stopwords.zip.
__________________ ERROR collecting tests/test_line_parser.py __________________
ImportError while importing test module '/repo/tests/test_line_parser.py'.
Hint: make sure your test modules/packages have valid Python names.
Traceback:
/usr/local/lib/python3.10/importlib/__init__.py:126: in import_module
    return _bootstrap._gcd_import(name[level:], package, level)
tests/test_line_parser.py:3: in <module>
    from ingestor import line_parser as lp
E   ModuleNotFoundError: No module named 'ingestor'
___________________ ERROR collecting tests/test_processor.py ___________________
ImportError while importing test module '/repo/tests/test_processor.py'.
Hint: make sure your test modules/packages have valid Python names.
Traceback:
/usr/local/lib/python3.10/importlib/__init__.py:126: in import_module
    return _bootstrap._gcd_import(name[level:], package, level)
tests/test_processor.py:3: in <module>
    from ingestor import formatter
E   ModuleNotFoundError: No module named 'ingestor'
________________ ERROR collecting tests/test_sent_tokenizer.py _________________
ImportError while importing test module '/repo/tests/test_sent_tokenizer.py'.
Hint: make sure your test modules/packages have valid Python names.
Traceback:
/usr/local/lib/python3.10/importlib/__init__.py:126: in import_module
    return _bootstrap._gcd_import(name[level:], package, level)
tests/test_sent_tokenizer.py:3: in <module>
    from ingestor_utils.utils import sent_tokenize
E   ModuleNotFoundError: No module named 'ingestor_utils'
=========================== short test summary info ============================
ERROR tests/run_ingestor_page_test.py - AttributeError: 'bool' object has no ...
ERROR tests/test_line_parser.py
ERROR tests/test_processor.py
ERROR tests/test_sent_tokenizer.py
!!!!!!!!!!!!!!!!!!! Interrupted: 4 errors during collection !!!!!!!!!!!!!!!!!!!!
no tests collected, 4 errors in 8.46s
The command execution failed, so I have reverted it back to the previous state, which is the environment before running this command.
`runtest` executes with returncode: 2

[Current directory]:
/
You are currently in a [python:3.10] container.

ENVIRONMENT REMINDER: You have 91 turns left to complete the task.
The container has successfully executed the following commands in order. Please refer to the execution history, reflect, and decide the subsequent actions. Remember, your ultimate goal is to pass the tests by executing `runtest` or `poetryruntest`.
cd /repo && pip install -e .
python -m nltk.downloader punkt
export PYTHONPATH=/repo
---------------------------
### Thought: The error messages indicate that the NLTK 'stopwords' resource needs to be downloaded, and there is a type error for the `stopwords` attribute. I will first download the NLTK 'stopwords' resource.
### Action:
```bash
python -m nltk.downloader stopwords
```
### Observation:
Running `python -m nltk.downloader stopwords`...
/usr/local/lib/python3.10/runpy.py:126: RuntimeWarning: 'nltk.downloader' found in sys.modules after import of package 'nltk', but prior to execution of 'nltk.downloader'; this may result in unpredictable behaviour
  warn(RuntimeWarning(msg))
[nltk_data] Downloading package stopwords to /root/nltk_data...
[nltk_data]   Unzipping corpora/stopwords.zip.
`python -m nltk.downloader stopwords` executes with returncode: 0

[Current directory]:
/
You are currently in a [python:3.10] container.

ENVIRONMENT REMINDER: You have 90 turns left to complete the task.
The container has successfully executed the following commands in order. Please refer to the execution history, reflect, and decide the subsequent actions. Remember, your ultimate goal is to pass the tests by executing `runtest` or `poetryruntest`.
cd /repo && pip install -e .
python -m nltk.downloader punkt
export PYTHONPATH=/repo
python -m nltk.downloader stopwords
---------------------------
### Thought: Now that the NLTK 'stopwords' resource has been downloaded, I will review the `nlm_ingestor/ingestor/line_parser.py` file to address the `AttributeError: 'bool' object has no attribute 'words'` issue and ensure that all imports are correctly pointing to the appropriate modules.
### Action:
```bash
cat /repo/nlm_ingestor/ingestor/line_parser.py
```
### Observation:
Running `cat /repo/nlm_ingestor/ingestor/line_parser.py`...
The output is too long, so we've truncated it to show you the first and last 5000 characters.
Running `cat /repo/nlm_ingestor/ingestor/line_parser.py`...
import datetime
import logging
import math
import re
import string
from nltk.corpus import stopwords
from .patterns import abbreviations
from .patterns import states
from .patterns import states_abbreviations
from .styling_utils import mode_of_list
try:
    stop_words = set(stopwords.words("english"))
except Exception as e:
    logging.error(e)
    import nltk
    stopwords = nltk.download("stopwords")
    stop_words = set(stopwords.words("english"))
stop_words.add("per")
continuing_chars = "!\"&'+,./:;<=?@\\]^_`|}~"
list_chars = [
    "•",
    "➢",
    "*",
    "ƒ",
    "",
    "",
    "",
    "",
    "»",
    "",
    "·",
    "�",
    "▪",
    "▪",
    "○",
    "",
    "–",
]
list_types = {
    "•": "circle",
    "➢": "wide_symbol_arrow",
    "*": "star",
    "ƒ": "f",
    "": "clock",
    "": "small_square",
    "": "narrow_symbol_arrow",
    "": "large_square",
    "»": "double_arrow",
    "": "hollow_square",
    "·": "circle",
    "�": "special_char",
    "▪": "very_small_square",
    "▪": "very_small_square",
    "○": "hollow_circle",
    "": "hollow_squere",
    "–": "dash",
    "‒": "another-dash",
    "̶": "underscore",
}
unicode_list_types = {
    "\\uf0b7": "•",
    "\\uf0fc": "",
}
footnote_types = {
    "©"
}
ambiguous_list_chars = ["+", "-"]
units = ["acres", "miles", "-"]  # - could represent a null value in a row
punctuations = string.punctuation + "“"
start_quotations = ["'", '"', "“"]
end_quotations = ["'", '"', ""]
"""
Quote Pattern details:
    \\W ==> Match non-alphanumeric characters. Helps in mitigating words like O'Reilly.
    ["“\'] ==> Quote patterns
    (?!\\D\\s) ==> Negative Lookahead for single character following the quote.
                        Helps in removing words like Macy's, don't ...
    (?!\\d+) ==> Negative Lookahead for one or more digits following the pattern.
                        Helps in removing words like '19, '2019
    (.*?)[,;.]?["\'] ==> Match all other data.
"""
# Add / Modify Quotation pattern in ingestor_utils/utils.py also.
quote_pattern = re.compile(
    r'(?:(?<=\W)|(?<=^))["“‘’\']+(?!\D\s)(?!\d+)(.*?)[,;.]?["‘’\']+',
)  # (r'["“\'](.*?)[,;.]?["\']')
single_char_pattern = re.compile(r'[a-zA-Z]')
multi_char_pattern = re.compile(r'[a-zA-Z]+')
roman_number_pattern = re.compile(r'[ixvIXV]+$')
ends_with_sentence_delimiter_pattern = re.compile(r"(?<![.;:][a-zA-Z0-9])(?<!INC|inc|Inc)[.;:]+(?![\w])[\"“‘’\'\s]*$")
conjunction_list = ["for", "and", "not", "but", "or", "yet", "so", "between"]
class Word:
    def __init__(self, token):
        self.text = token
        self.is_percent = False
        self.is_number = False
        self.is_year = False  # year does not count as a number
        self.is_dollar = False
        self.is_million = False
        self.is_billion = False
        self.is_thousand = False
        self.is_date_entry = False
        self.is_negative = False
        self.length = len(self.text)
        self.is_stop_word = self.text.lower() in stop_words
        self.is_number_range = False
        self.parts = []
        text_without_punct = self.text
        while (
                len(text_without_punct) > 1 and
                (text_without_punct[-1] in string.punctuation or text_without_punct[-1] in end_quotations)
        ):
            text_without_punct = text_without_punct[0:-1]
        # remove leading unbalancced punctuations
        while (
                len(text_without_punct) > 1 and
                (text_without_punct[0] in string.punctuation or text_without_punct[0] in start_quotations)
        ):
            text_without_punct = text_without_punct[1:]
        self.text_without_punct = text_without_punct
        self.is_noun = self.text_without_punct[0].isupper()
        n = self.check_numeric()
        self.check_date()
        try:
            if n:
                n = round(float(n))
                if n > 0:
                    digits = int(math.log10(n)) + 1
                elif n == 0:
                    digits = 1
                else:
                    digits = int(math.log10(-n)) + 2
                self.num_digits = digits
                if digits == 4 and self.text.replace(",", "") == self.text:
                    self.is_year = True
                    self.is_number = False
            else:
                self.num_digits = 0
        except Exception as e:
            logging.error(e)
            self.num_digits = 0
    def check_date(self):
        if "/" in self.text or "-" in self.text:
            text = self.text.replace("/", "-")
            date_patterns = [
                "%b-%d",
                "%B-%d",
                "%B-%d-%y",
                "%B-%d-%Y",
                "%b-%d-%Y",
                "%b-%d-%y",
                "%m-%d",
                "%m-%d-%y",
                "%m-%d-%Y",
            ]
            for pat in date_patterns:
                try:
                    datetime.datetime.strptime(text, pat)
                    self.is_date_entry = True
                    return
                except ValueError:
                    pass
        else:
            self.is_date_entry = False
    def check_numeric(self):
        word = self.text.lower()
        if not word.isalpha():
            if word.isprintable():
                if not word.isnumeric():
                    if word.startswith("(") and word.endswith(")"):
                        word = word[1:-1]
                    if word.startswith("-"):
                        self.is_negative = True
                        word = word[1:]
                    if word.startswith("$"):
                        self.is_dollar = True
                        word = word[1:]
                    elif word.endswith("$"):
                        self.is_dollar = True
                        word = word[0:-1]
                    elif word.endswith("%"):
                        self.is_percent = True
                        word = word[0:-1
...[Truncation]...
is_next_space_smallest = False
        self.wrapped_page = False
        self.text = " ".join(self.text_list)
        if style_dict:
            self.start_x = style_dict["start_x"][0]
            self.start_y = style_dict["start_y"][0]
            self.end_x = style_dict["end_x"][-1]
            self.end_y = style_dict["end_y"][-1]
            self.fs = style_dict["line_fs"][0]
            self.fw = style_dict["line_fw"][0]
            self.diff_prev_y = style_dict["diff_prev_y"][0]
            self.diff_next_y = style_dict["diff_next_y"][0]
            self.font_family = (
                style_dict["font_family"][0] if len(style_dict["font_family"]) else None
            )
            self.font_style = (
                style_dict["font_style"][0] if len(style_dict["font_style"]) else None
            )
            self.min_x = (
                self.start_x
            )  # these variables are adjustable during line joins for line width
            self.max_x = self.end_x
            self.start_x_list = style_dict["start_x"]  # joined ents
            self.end_x_list = style_dict["end_x"]  # joined ents
            self.start_x_list_single_ent = style_dict["start_x_list"][0]
            self.end_x_list_single_ent = style_dict["end_x_list"][0]
            self.mode_fs = mode_of_list(style_dict["line_fs"])
            self.tab_count = 0
            # calculates tabs for when tika misses word split
            if len(self.start_x_list_single_ent) == len(self.end_x_list_single_ent):
                self.start_end_list = list(
                    zip(self.start_x_list_single_ent, self.end_x_list_single_ent),
                )
                for word_x, next_word_x in zip(
                    self.start_end_list[:-1],
                    self.start_end_list[1:],
                ):
                    word_start_x, word_end_x = word_x
                    next_word_start_x, next_word_end_x = next_word_x
                    word_distance = next_word_start_x - word_end_x
                    if word_distance > 20:
                        self.tab_count += 1
            else:
                self.start_end_list = []
            self.tab_count_join = 0  # tab count after join in ptolines
            # calculates tabs for when tika misses word split
            if len(self.start_x_list) == len(self.end_x_list):
                self.start_end_list_join = list(
                    zip(self.start_x_list, self.end_x_list),
                )
                for word_x, next_word_x in zip(
                    self.start_end_list_join[:-1],
                    self.start_end_list_join[1:],
                ):
                    word_start_x, word_end_x = word_x
                    next_word_start_x, next_word_end_x = next_word_x
                    word_distance = next_word_start_x - word_end_x
                    if word_distance > 20:
                        self.tab_count_join += 1
            else:
                self.start_end_list_join = []
            if len(self.text.split()) == 2 and self.tab_count == 1:
                self.text_list = self.text.split()
            # Count tabs in text list, Eventually make it a function of font size
            self.start_fs = round(style_dict["start_fs"][0], 1)
            self.end_fs = round(style_dict["end_fs"][-1], 1)
            self.compute_visual_features(page_stats)
    def compute_visual_features(self, page_stats):
        # compute font size relative to most common font
        font_sizes_mode = page_stats["mode_fs"]
        if self.fs > (4 / 3) * font_sizes_mode:
            self.is_comparably_sized = True
        else:
            self.is_comparably_sized = False
        # compute font weight relative to 600.0 which has generally
        # been observed to correspond to bolding of some sort
        font_weights_mode = page_stats["mode_fw"]
        if font_weights_mode >= 600.0:
            self.is_comparably_bolded = False
        elif self.fw > 600.0:
            self.is_comparably_bolded = True
        # compare line height for similar type (same font) lines
        if page_stats["fs_and_diff_prev_y"].get((self.fs, self.diff_prev_y), 0) > 2:
            for k, v in page_stats["fs_and_diff_prev_y"].items():
                if k == self.fs and 0 <= v < self.diff_prev_y:
                    break
            else:
                self.is_prev_space_smallest = True
        if page_stats["fs_and_diff_next_y"].get((self.fs, self.diff_next_y), 0) > 2:
            for k, v in page_stats["fs_and_diff_next_y"].items():
                if k == self.fs and 0 <= v < self.diff_next_y:
                    break
            else:
                self.is_next_space_smallest = True
    def should_join_table(self, next_line):
        """
        Check if next line should be joined as a tr. This makes no assumption if the current line is a table
        """
        # check list of spaced words
        curr_line_ents = len(self.text_list)
        next_line_ents = len(next_line.text_list)
        ent_match = (
            curr_line_ents == next_line_ents and curr_line_ents >= 2
        )  # tr should have at least two elements
        # compare alignment of elements in both lists
        if ent_match:
            return
        return False
    def should_join_para(self):
        return False
    def should_join_header(self):
        return False
    def __str__(self):
        output_str = f"\ntext_list = {self.text_list},\nstart_x = {self.start_x}, \nstart_y = {self.start_y}\nend_x = {self.end_x},\nend_y = {self.end_y},\nfs = {self.fs},\nfw = {self.fw},\nstart_fs = {self.start_fs},\nend_fs = {self.end_fs},\ndiff_prev_y = {self.diff_prev_y},\ndiff_next_y = {self.diff_next_y},\nis_comparably_sized = {self.is_comparably_sized},\nis_comparably_bolded = {self.is_comparably_bolded},\nis_prev_space_small = {self.is_prev_space_smallest}\nis_next_space_small = {self.is_next_space_smallest},"
        output_str += f"\nfont_style = {self.font_style}"
        return output_str
`cat /repo/nlm_ingestor/ingestor/line_parser.py` executes with returncode: 0

[Current directory]:
/
You are currently in a [python:3.10] container.

ENVIRONMENT REMINDER: You have 89 turns left to complete the task.
The container has successfully executed the following commands in order. Please refer to the execution history, reflect, and decide the subsequent actions. Remember, your ultimate goal is to pass the tests by executing `runtest` or `poetryruntest`.
cd /repo && pip install -e .
python -m nltk.downloader punkt
export PYTHONPATH=/repo
python -m nltk.downloader stopwords
---------------------------
### Thought: The current approach for handling `stopwords` seems to have an issue. The code tries to download the `stopwords` corpus if it encounters an exception, but after downloading, it reuses the same variable name `stopwords` as a boolean. I need to modify the error-handling logic to avoid this naming conflict.
### Action:
```diff
/repo/nlm_ingestor/ingestor/line_parser.py
<<<<<<< SEARCH
    stopwords = nltk.download("stopwords")
=======
    nltk.download("stopwords")
    stopwords = nltk.corpus.stopwords
>>>>>>> REPLACE
```
### Observation:
Running Edit...
[?2004l
* Succeed Patch:
--- a/repo/nlm_ingestor/ingestor/line_parser.py
+++ b/repo/nlm_ingestor/ingestor/line_parser.py
@@ -17,7 +17,8 @@
     logging.error(e)
     import nltk
 
-    stopwords = nltk.download("stopwords")
+    nltk.download("stopwords")
+    stopwords = nltk.corpus.stopwords
     stop_words = set(stopwords.words("english"))
 
 stop_words.add("per")


[Current directory]:
/
You are currently in a [python:3.10] container.

ENVIRONMENT REMINDER: You have 88 turns left to complete the task.
The container has successfully executed the following commands in order. Please refer to the execution history, reflect, and decide the subsequent actions. Remember, your ultimate goal is to pass the tests by executing `runtest` or `poetryruntest`.
cd /repo && pip install -e .
python -m nltk.downloader punkt
export PYTHONPATH=/repo
python -m nltk.downloader stopwords
python /home/tools/code_edit.py -t '/tmp/patch/tmpwlwks5ap' -p '/tmp'
---------------------------
### Thought: Now that the error with NLTK `stopwords` should be resolved, I will rerun the tests to see if we can progress further in resolving the issues and collecting the tests.
### Action:
```bash
export PYTHONPATH=/repo && runtest
```
### Observation:
Running `export PYTHONPATH=/repo`...
`export PYTHONPATH=/repo` executes with returncode: 0
Running `python /home/tools/runtest.py`...
Error: Please modify the configuration according to the error messages below. Once all issues are resolved, rerun the tests.
==================================== ERRORS ====================================
__________________ ERROR collecting tests/test_line_parser.py __________________
ImportError while importing test module '/repo/tests/test_line_parser.py'.
Hint: make sure your test modules/packages have valid Python names.
Traceback:
/usr/local/lib/python3.10/importlib/__init__.py:126: in import_module
    return _bootstrap._gcd_import(name[level:], package, level)
tests/test_line_parser.py:3: in <module>
    from ingestor import line_parser as lp
E   ModuleNotFoundError: No module named 'ingestor'
___________________ ERROR collecting tests/test_processor.py ___________________
ImportError while importing test module '/repo/tests/test_processor.py'.
Hint: make sure your test modules/packages have valid Python names.
Traceback:
/usr/local/lib/python3.10/importlib/__init__.py:126: in import_module
    return _bootstrap._gcd_import(name[level:], package, level)
tests/test_processor.py:3: in <module>
    from ingestor import formatter
E   ModuleNotFoundError: No module named 'ingestor'
________________ ERROR collecting tests/test_sent_tokenizer.py _________________
ImportError while importing test module '/repo/tests/test_sent_tokenizer.py'.
Hint: make sure your test modules/packages have valid Python names.
Traceback:
/usr/local/lib/python3.10/importlib/__init__.py:126: in import_module
    return _bootstrap._gcd_import(name[level:], package, level)
tests/test_sent_tokenizer.py:3: in <module>
    from ingestor_utils.utils import sent_tokenize
E   ModuleNotFoundError: No module named 'ingestor_utils'
=========================== short test summary info ============================
ERROR tests/test_line_parser.py
ERROR tests/test_processor.py
ERROR tests/test_sent_tokenizer.py
!!!!!!!!!!!!!!!!!!! Interrupted: 3 errors during collection !!!!!!!!!!!!!!!!!!!!
no tests collected, 3 errors in 6.88s
The command execution failed, so I have reverted it back to the previous state, which is the environment before running this command.
`runtest` executes with returncode: 2

[Current directory]:
/
You are currently in a [python:3.10] container.

ENVIRONMENT REMINDER: You have 87 turns left to complete the task.
The container has successfully executed the following commands in order. Please refer to the execution history, reflect, and decide the subsequent actions. Remember, your ultimate goal is to pass the tests by executing `runtest` or `poetryruntest`.
cd /repo && pip install -e .
python -m nltk.downloader punkt
export PYTHONPATH=/repo
python -m nltk.downloader stopwords
python /home/tools/code_edit.py -t '/tmp/patch/tmpwlwks5ap' -p '/tmp'
export PYTHONPATH=/repo
---------------------------
### Thought: There are still `ModuleNotFoundError` issues for `ingestor` and `ingestor_utils`. The PYTHONPATH might need to explicitly include the `nlm_ingestor` directory for these paths to be resolved correctly. I will adjust the PYTHONPATH to include both `/repo` and `/repo/nlm_ingestor`.
### Action:
```bash
export PYTHONPATH=/repo:/repo/nlm_ingestor && runtest
```
Congratulations, you have successfully configured the environment!
tests/test_line_parser.py::MyTest::test_continuing_line
tests/test_line_parser.py::MyTest::test_counts
tests/test_line_parser.py::MyTest::test_ends_with_abbreviation
tests/test_line_parser.py::MyTest::test_incomplete_line
tests/test_line_parser.py::MyTest::test_is_header
tests/test_line_parser.py::MyTest::test_is_list_item
tests/test_line_parser.py::MyTest::test_is_table_row
tests/test_line_parser.py::MyTest::test_is_zipcode_or_po
tests/test_line_parser.py::MyTest::test_line_type
tests/test_line_parser.py::MyTest::test_non_ascii
tests/test_line_parser.py::MyTest::test_noun_chunks
tests/test_line_parser.py::MyTest::test_numbered_line
tests/test_line_parser.py::MyTest::test_numbers
tests/test_line_parser.py::MyTest::test_quotation_words
tests/test_line_parser.py::MyTest::test_start_number
tests/test_processor.py::MyTest::test_line_join
tests/test_processor.py::MyTest::test_mixed_cased_words
tests/test_processor.py::MyTest::test_spaced_characters
tests/test_sent_tokenizer.py::PreProcessingTests::test_sentence_tokenizer

19 tests collected in 11.50s
Container 75c5a200dcfa stopped and removed
Spend totally 346.12423968315125.
